{
  "created_at": "2026-07-21T08:00:00Z",
  "frames": [
    {
      "caption": "创作者出镜，桌面摆放芯片开发板",
      "confidence": 0.9,
      "frame_time_ms": 0,
      "labels": [
        "person",
        "product",
        "desk"
      ],
      "reasons": [
        "KEYFRAME"
      ],
      "schema_version": "1"
    },
    {
      "caption": "屏幕录制：跑分图表",
      "confidence": 0.86,
      "frame_time_ms": 3000,
      "labels": [
        "screen_record",
        "chart"
      ],
      "reasons": [
        "SCENE_CUT",
        "TEXT_CHANGE"
      ],
      "schema_version": "1"
    },
    {
      "caption": null,
      "confidence": null,
      "frame_time_ms": 8000,
      "labels": [],
      "reasons": [
        "LOW_CONFIDENCE"
      ],
      "schema_version": "1"
    }
  ],
  "id": "01J2ZK3AC9V6XW8YQ4R5T6U7ZA",
  "sampling_policy": "representative@v1",
  "schema_version": "1",
  "source_artifact_id": "01J2ZK3AC9V6XW8YQ4R5T6U7W1",
  "vlm_provider": "vlm.qwen_vl",
  "vlm_version": "max-0809"
}
